{
  "case_id": "case-0558bfc1d8c7",
  "created_at": "2026-05-29T14:06:16.626861Z",
  "patient": {
    "age": null,
    "sex": null,
    "deidentified": true
  },
  "chief_complaint": "Not provided by this public validation fixture. This field is intentionally non-diagnostic.",
  "clinical_notes_summary": "Source dataset: Teeth segmentation panoramic X-ray dataset Source URL: https://www.kaggle.com/datasets/humansintheloop/teeth-segmentation-on-dental-x-ray-images Modality: panoramic X-ray Validation focus: missing teeth Purpose: MCP and Dental Case Packet infrastructure validation. No imaging interpretation, diagnosis, or treatment recommendation is performed. Source note: Open panoramic dental X-ray segmentation dataset derived from public radiographs.",
  "treatment_plan_summary": "",
  "imaging": {
    "cbct": {
      "available": false,
      "series_count": 0,
      "dicom_metadata_summary": {},
      "warnings": []
    },
    "xray": {
      "available": true,
      "files": [
        {
          "path": "xray/panoramic_fixture.png",
          "format": "png"
        }
      ]
    },
    "intraoral_scan": {
      "available": false,
      "files": [],
      "formats": []
    },
    "photos": {
      "available": false,
      "files": []
    }
  },
  "ai_ready_context": {
    "case_overview": "Chief complaint: Not provided by this public validation fixture. This field is intentionally non-diagnostic. Clinical notes available: Source dataset: Teeth segmentation panoramic X-ray dataset Source URL: https://www.kaggle.com/datasets/humansintheloop/teeth-segmentation-on-dental-x-ray-images Modality: panoramic X-ray Validation focus: missing teeth Purpose: MCP and Dental Case Packet infrastructure validation. No imaging interpretation, diagnosis, or treatment recommendation is performed. Source note: Open panoramic dental X-ray segmentation dataset derived from public radiographs.",
    "known_information": [
      "chief_complaint",
      "clinical_notes",
      "xray"
    ],
    "missing_information": [
      "Missing treatment_plan.txt.",
      "Missing CBCT DICOM records.",
      "Missing Intraoral scan files.",
      "Missing Clinical photos."
    ],
    "clinical_review_questions": [
      "Please confirm that the de-identified packet accurately reflects the available records.",
      "Please identify whether any omitted source records should be added before AI workflow use.",
      "Please confirm whether the missing records are unavailable or intentionally omitted."
    ],
    "llm_prompt_context": "You are reviewing a de-identified dental case packet. Do not diagnose. Do not provide treatment recommendations. Summarize the available information, identify missing records, and generate questions for dentist review. All output is for clinical review only.\n\nCase overview: Chief complaint: Not provided by this public validation fixture. This field is intentionally non-diagnostic. Clinical notes available: Source dataset: Teeth segmentation panoramic X-ray dataset Source URL: https://www.kaggle.com/datasets/humansintheloop/teeth-segmentation-on-dental-x-ray-images Modality: panoramic X-ray Validation focus: missing teeth Purpose: MCP and Dental Case Packet infrastructure validation. No imaging interpretation, diagnosis, or treatment recommendation is performed. Source note: Open panoramic dental X-ray segmentation dataset derived from public radiographs.\nMissing information: Missing treatment_plan.txt.; Missing CBCT DICOM records.; Missing Intraoral scan files.; Missing Clinical photos."
  },
  "safety": {
    "not_for_diagnosis": true,
    "requires_dentist_review": true,
    "phi_removed": true
  }
}